{
  "schema_version": "studiopilot.human_command.v0",
  "command_id": "human-command-2026-05-09-build-control-plane-001",
  "issued_by": "HUMAN_FOUNDER",
  "command_type": "BUILD_ALLOWED",
  "target_scope": "CONTROL_PLANE",
  "freeze_targets": [
    "FREEZE_RUNTIME",
    "FREEZE_SEARCH",
    "FREEZE_NEURAL",
    "FREEZE_ML",
    "FREEZE_DATASET",
    "FREEZE_CLAIMS"
  ],
  "allowed_actions": [
    "edit_control_plane_docs",
    "edit_control_plane_schemas",
    "edit_control_plane_local_tools",
    "run_local_control_plane_validation"
  ],
  "forbidden_actions": [
    "auto_merge",
    "auto_ready",
    "benchmark_automatic",
    "training",
    "runtime_change_without_scope",
    "claim_escalation",
    "github_api_call",
    "openai_api_call"
  ],
  "human_gate_required": true,
  "auto_merge_allowed": false,
  "auto_ready_allowed": false,
  "claim_scope": "NO_CLAIM_ALLOWED",
  "expires_after_task": true,
  "reason": "Founder allows bounded control-plane implementation only; sensitive runtime and evidence surfaces remain frozen."
}
