{
  "schema_version": "studiopilot.human_command.v0",
  "command_id": "human-command-2026-05-09-stop-automation-001",
  "issued_by": "HUMAN_FOUNDER",
  "command_type": "STOP_AUTOMATION",
  "target_scope": "AUTOMATION",
  "freeze_targets": [
    "FREEZE_AUTOMATION"
  ],
  "allowed_actions": [
    "report_stopped_state"
  ],
  "forbidden_actions": [
    "auto_merge",
    "auto_ready",
    "benchmark_automatic",
    "training",
    "runtime_change_without_scope",
    "claim_escalation",
    "automation_continue",
    "automation_retry"
  ],
  "human_gate_required": true,
  "auto_merge_allowed": false,
  "auto_ready_allowed": false,
  "claim_scope": "NO_CLAIM_ALLOWED",
  "expires_after_task": false,
  "reason": "Founder halts automation and permits only reporting of the stopped state."
}
